"Descripción del contrato","Entidad ","Contratista","Nomenclatura del proceso","Número del contrato","Objeto ","Moneda ","Monto ","Presupuesto ","CCP ","Previsión Presupuestal ","Fecha de suscripción del contrato","Fecha de inicio del contrato","Fecha fin del contrato","Estado"
"ADQUISICIÓN DE CANALIZADOR VIAL, TIPO NEW JERSEY PRA EL MANTENIMIENTO DE PARADEROS DE TRANSPORTE REGULAR DE LIMA Y CALLAO","20604932964-AUTORIDAD DE TRANSPORTE URBANO PARA LIMA Y CALLAO","20492999157-SIGNO VIAL PERU S.A.C.","AS-SM-29-2021-ATU-1","CONTRATO N°002-2022-ATU-GG-OA","BIEN","S/","366272","824112","824112"," ","10/01/2022","11/01/2022","31/03/2022","Publicado"
"ADQUISICIÓN DE OCHENTA (80) CÁMARAS DE VIDEO VIGILANCIA IP PARA EL REEMPLAZO DE CÁMARAS INOPERATIVAS EN EL SISTEMA DE VIDEO VIGILANCIA IP CCTV DEL COSAC I - METROPOLITANO DE LA AUTORIDAD DE TRANSPORTE REGULAR ATU","20604932964-AUTORIDAD DE TRANSPORTE URBANO PARA LIMA Y CALLAO","20565740181-CU SECURITY E.I.R.L.","AS-SM-30-2021-ATU-1","CONTRATO N° 003-2022-ATU/GG-OA","BIEN","S/","248726.36","248726.36","248726.36"," ","12/01/2022","13/01/2022","31/01/2022","Publicado"
"SERVICIO PARA REALIZAR LA TOMA DE INVENTARIO FISICO DE BIENES MUEBLES PATRIMONIALES DE LA AUTORIDAD DE TRANSPORTE URBANO PARA LIMA Y CALLAO- ATU AL 31.12.2021","20604932964-AUTORIDAD DE TRANSPORTE URBANO PARA LIMA Y CALLAO","20544419839-INVENTARIOS VALUACIONES Y SERVICIOS GENERALES S.A.C. - IVASERG S.A.C.","AS-SM-36-2021-ATU-1","004-2022-ATU/GG-OA","SERVICIO","S/","79000","79000","79000","122500","19/01/2022","20/01/2022","30/05/2022","Publicado"
" ADQUISICION DE MOBILIARIO Y EQUIPO MEDICO PARA LA IMPLEMENTACION DE UN TOPICO EN LA ESTACION CENTRAL - COSAC","20604932964-AUTORIDAD DE TRANSPORTE URBANO PARA LIMA Y CALLAO","20447790999-EXPORT PERU GLOBAL SOCIEDAD ANONIMA CERRADA","AS-SM-33-2021-ATU-1","OC N° 21-2022","BIEN","S/","67500","67500","67500"," ","15/02/2022","16/02/2022","22/02/2022","Publicado"
"SERVICIO DE ARRENDAMIENTO DE LOCAL PARA INTERNAMIENTO DE VEHÍCULOS CON MEDIDA EN FORMA DE SECUESTRO CONSERVATIVO PRODUCTO DE LA COBRANZA DE MULTAS EN ESTADO COACTIVO BAJO COMPETENCIA DE LA AUTORIDAD DE TRANSPORTE URBANO PARA LIMA Y CALLAO - ATU","20604932964-AUTORIDAD DE TRANSPORTE URBANO PARA LIMA Y CALLAO","10090131317-INAFUKU TERUYA ENRIQUE","DIRECTA-PROC-18-2021-ATU-1","001-2022-ATU/GG-OA","SERVICIO","S/","540000","540000","495000","585000","07/01/2022","08/01/2022","07/01/2023","Publicado"
"Contratacion de bienes: Adquisicion de mezcla asfaltica en caliente para la ejecucion de la obra: ""Creacion del servicio de transitabilidad peatoonal y vehicular en la Av. La Capitana, Av. Los Claveles y Av. Las Ruinas de la Asociación de Pueblos Unidos por el Desaroollo de Nievería, Distrito de Lurigancho - Provincia de Lima - Departamento de Lima"" CUI N° 2480429","20131371455-MUNICIPALIDAD DISTRITAL DE LURIGANCHO (CHOSICA)","20602794084-CONSTRUCCIONES NEGOCIACIONES & TRANSPORTES. NANO S.A.C.","LP-SM-4-2021-MDL/CS-1","001-2022-SGLYSG-GAF-MDL","BIEN","S/","538875","538875","538875","370260","24/01/2022","25/01/2022","14/04/2022","Publicado"
"ADQUISICION DE ASFALTO LIQUIDO MC30","20131371455-MUNICIPALIDAD DISTRITAL DE LURIGANCHO (CHOSICA)","20602794084-CONSTRUCCIONES NEGOCIACIONES & TRANSPORTES. NANO S.A.C.","SIE-SIE-19-2021-OEC-MDL/BIENES-2","ORDEN DE COMPRA 2022-04","BIEN","S/","62370","62370","62370"," ","11/01/2022","12/01/2022","04/04/2022","Publicado"
"ADQ DE INSUMOS QUE CONFORMAN LA RACION ALIMENTICIA PARA EL PROGRAMA DEL VASO DE LECHE DE LA MUNICIPALIDAD DE LURIGANCHO CHOSICA PERIODO 2022-2023","20131371455-MUNICIPALIDAD DISTRITAL DE LURIGANCHO (CHOSICA)","20510051395-SOLUCIONES ALIMENTICIAS SAC - SOAL SAC","LP-SM-5-2021-MDL/CS-1","002-2022-SGLySG-GAF-MDL","BIEN","S/","5218422.85","5218422.85","2512719","2705703.85","27/01/2022","28/01/2022","20/12/2023","Publicado"
"ADQUISICION DE CEMENTO PORTLAND TIPO I","20131371455-MUNICIPALIDAD DISTRITAL DE LURIGANCHO (CHOSICA)","20392930567-SYTAH CONTRATISTAS GENERALES E.I.R.L.","SIE-SIE-22-2021-OEC-MDL-BIENES-1","OC N° 2022-00022","BIEN","S/","101483","101483","101483","76600","21/01/2022","22/01/2022","17/03/2022","Publicado"
"ADQUISICION DE MATERIAL GRANULAR PARA BASE TIPO A","20131371455-MUNICIPALIDAD DISTRITAL DE LURIGANCHO (CHOSICA)","10408178938-CUESTAS SUPÑO JORGE LUIS","SIE-SIE-23-2021-OEC-MDL-BIENES-1","OC N° 2022-0012","BIEN","S/","51000","51000","51000"," ","17/01/2022","25/01/2022","03/02/2022","Publicado"
"adquisicion de mezcla asfaltica en caliente","20131371455-MUNICIPALIDAD DISTRITAL DE LURIGANCHO (CHOSICA)","20601373581-GEOMASTER PERU S.A.C.","AS-SM-29-2021-OEC-MDL/BIENES-1","orden de compra nro. 20","BIEN","S/","184719","184719","184719"," ","02/02/2022","04/02/2022","10/02/2022","Publicado"
"servicio de consultoria para la supervision de la ejecucion de la obra: creacion del servicio de transitabilidad vehicular y peatonal en la av. 24 de setiembre y en los tramos de la av. carapongo (av. nro. 02 y calle n° 01) del distrito de lurigancho-provincia de lima.","20131371455-MUNICIPALIDAD DISTRITAL DE LURIGANCHO (CHOSICA)","10088392448-LEYVA CUEVA JOSE LUIS","AS-SM-23-2021-MDL/CS-1","003-2022-SGLYSG-GAF-MDL","CONSULTORIA","S/","147273.15","147273.15","147273.15"," ","07/02/2022","08/02/2022","06/09/2022","Publicado"
"ADQUISICION DE 20 MOTOCICLETAS LINEAL PARA LA SUB GERENCIA DE SERENAZGO DE LA MDL-CH","20131371455-MUNICIPALIDAD DISTRITAL DE LURIGANCHO (CHOSICA)","20522018962-MOTOS RACING TEAM S.A.C.","AS-SM-28-2021-OEC-MDL-BIENES-1","ORDEN DE COMPRA Nº 029-2022","BIEN","S/","147000","147000","147000"," ","24/01/2022","24/01/2022","31/03/2022","Publicado"
"ADQUISICION DE MATERIAL GRANULAR PARA BASE TIPO B","20131371455-MUNICIPALIDAD DISTRITAL DE LURIGANCHO (CHOSICA)","10408178938-CUESTAS SUPÑO JORGE LUIS","SIE-SIE-18-2021-OEC-MDL/BIENES-2","ORDEN DE COMPRA Nº 32-2022","BIEN","S/","120000","120000","120000"," ","24/01/2022","24/01/2022","31/03/2022","Publicado"
" ADQUISICION DE MEZCLA ASFALTICA PARA LA EJECUCION DE LA OBRA CREACION DEL SERVICIO DE TRANSITABILIDAD VEHICULAR Y PEATONAL EN LA COORPERATIVA DE VIVIENDA PABLO PATRON (CALLE LOS GERANIOS), ASOCIACION PRO VIVIENDA Y URBANIZADORA SOLIS GARCIA (PROLONGACION CAMINO REAL Y PASAJES 1º, 3º Y 4º) Y CALLE CAMINO REAL LIMITE CON LA URBANIZACION SAN FERNANDO ALTO ¿ DISTRITO DE LURIGANCHO ¿ PROVINCIA DE LIMA ¿ DEPARTAMENTO DE LIMA CON CODIGO UNICO DE INVERSIONES Nº 2519677","20131371455-MUNICIPALIDAD DISTRITAL DE LURIGANCHO (CHOSICA)","20608080067-ORCOM CORPORATION S.A.C.","AS-SM-1-2022-OEC-MDL-BIENES-1","ORDEN DE COMPRA Nº 126","BIEN","S/","143910.78","143910.78","143910.78"," ","14/02/2022","14/02/2022","28/02/2022","Publicado"
"CONTRATACION DEL SERVICIO DE NOTIFICACION DE CARPETAS DE LIQUIDACIÓN DE TRIBUTOS MUNICIPALES AÑO 2022","20131377224-MUNICIPALIDAD DISTRITAL DE MIRAFLORES - LIMA","20524674891-MITO COURIER S.A.C.","AS-SM-19-2021-CS/MM-1","01-2022","SERVICIO","S/","36088","36088","36088","41640","06/01/2022","19/01/2022","15/02/2022","Publicado"
"CREACIÓN DEL ESTABLECIMIENTO MUNICIPAL DE SALUD EN EL DISTRITO DE PUENTE PIEDRA - PROVINCIA DE LIMA - DEPARTAMENTO DE LIMA ¿ CÓDIGO ÚNICO DE INVERSIÓN N°2516751","20131366702-MUNICIPALIDAD DISTRITAL DE PUENTE PIEDRA","20528924221-CONSORCIO MAX SALUD","LP-SM-3-2021-CS-MDPP-1","003-2022-MDPP","OBRA","S/","26924896.45","26924896.45","26924896.45","0","18/01/2022","06/02/2022","01/02/2023","Publicado"
"CONTRATACIÓN DEL SERVICIO DE CONSULTORÍA PARA LA SUPERVISIÓN Y LIQUIDACIÓN DE EJECUCIÓN DE OBRA DEL PROYECTO CON CUI N° 2516751","20131366702-MUNICIPALIDAD DISTRITAL DE PUENTE PIEDRA","20542487179-CONSORCIO SUPERVISOR PUENTE PIEDRA","CP-SM-4-2021-CS-MDPP-1","008-2022-MDPP","CONSULTORIA","S/","1372424.67","1372425","0","1372425","01/02/2022","07/02/2022","10/02/2023","Publicado"
"ADQUISICION DE ALIMENTOS PARA EL PROGRAMA DE COMPLEMENTACION ALIMENTARIA (PCA) AÑO 2022","20131366702-MUNICIPALIDAD DISTRITAL DE PUENTE PIEDRA","20523108493-INVERSIONES KATHYMAR S.A.C.","SIE-SIE-4-2021-CS/MDPP-1","6","BIEN","S/","1608000","1608000","1608000"," ","27/01/2022","27/01/2022","31/10/2022","Publicado"
"MEJORAMIENTO DEL SERVICIO DE TRANSITABILIDAD VEHICULAR Y PEATONAL EN LA CA. LOS ALAMOS, CA. LOS SAUCES, CA. ROSEDAL - SECTOR ENSENADA - DISTRITO DE PUENTE PIEDRA - PROVINCIA DE LIMA - DEPARTAMENTO DE LIMA","20131366702-MUNICIPALIDAD DISTRITAL DE PUENTE PIEDRA","20300116192-VACHAVEZ CONTRATISTAS GENERALES SRLTDA","AS-SM-28-2021-CS-MDPP-1","002-2022-MDPP","OBRA","S/","1797188.89","1797188.89","1797188.89"," ","17/01/2022","31/01/2022","02/05/2022","Publicado"
"CONTRATACIÓN PARA LA EJECUCIÓN DE LA OBRA; CREACIÓN DEL SERVICIO DE TRANSITABILIDAD VEHICULAR Y PEATONAL EN LA CALLE SANTA ROSA DE LA ASOCIACIÓN DE VIVIENDA PASAJE SANTA ROSA ¿ SECTOR LA GRAMA ¿ DISTRITO DE PUENTE PIEDRA ¿ PROVINCIA DE LIMA ¿ DEPARTAMENTO DE LIMA, CON CUI Nº2532856","20131366702-MUNICIPALIDAD DISTRITAL DE PUENTE PIEDRA","20300116192-VACHAVEZ CONTRATISTAS GENERALES SRLTDA","AS-SM-27-2021-CS-MDPP-1","001-2022-MDPP","OBRA","S/","390000.1","390001","390001"," ","14/01/2022","30/01/2022","31/03/2022","Publicado"
"SERVICIO DE IMPRESIÓN PARA LA EMISION MASIVA DE CUPONERAS DE PAGO CORRESPONDIENTE AL AJERCICO FISCAL 2022","20131366702-MUNICIPALIDAD DISTRITAL DE PUENTE PIEDRA","20544033051-BRYAN IMPRESORES & SERVICIOS GENERALES E.I.R.L.","AS-SM-25-2021-CS/MDPP-1","004","SERVICIO","S/","183920","183920","183920"," ","20/01/2022","20/01/2022","15/02/2022","Publicado"
"CONTRATACIÓN DEL SERVICIO DE ALQUILER DE IMPRESORAS MULTIFUNCIONALES PARA LAS DIFERENTES UNIDADES ORGÁNICAS DE LA MDPP","20131366702-MUNICIPALIDAD DISTRITAL DE PUENTE PIEDRA","20600653173-NEGOCIOS Y SERVICIOS INTELIGENTES SOCIEDAD ANONIMA CERRADA-NEGOCIOS Y SERVICIOS INTELIGENTES S.A.C.","AS-SM-24-2021-CS-MDPP-1","005-2022-mdpp","SERVICIO","S/","360000","395760","355209.47","40550.53","26/01/2022","01/02/2022","31/01/2023","Publicado"
"ADQUISICIÓN DE EQUIPOS DE BOMBEO PARA LA OBRA; RENOVACIÓN DE ÁREA VERDE ; EN EL (LA) ESPACIOS PÚBLICOS DEL DISTRITO DE PUENTE PIEDRA ¿ DISTRITO DE PUENTE PIEDRA ¿ PROVINCIA DE LIMA ¿ DEPARTAMENTO DE LIMA, CON CUI NO.2520120","20131366702-MUNICIPALIDAD DISTRITAL DE PUENTE PIEDRA","20606987944-TECHNOLOGY CONSULTING PROJECTS S.A.C.","COMPRE-SM-64-2021-OEC-MDPP-1","13-2022","BIEN","S/","57667","57667","57667"," ","25/01/2022","26/01/2022","27/01/2022","Publicado"
"contratación para la consultoría de obra para la supervisión y liquidación de la obra; Mejoramiento del Servicio de transitabilidad vehicular y peatonal ca. Los Álamos, ca. Los Sauces, ca. Rosedal ¿ Sector La Ensenada ¿ Distrito de Puente Piedra ¿ Provincia de Lima ¿ Departamento de Lima, con CUI Nº2532486","20131366702-MUNICIPALIDAD DISTRITAL DE PUENTE PIEDRA","10402898271-ORDOÑEZ SACIETA MABEL PATRICIA","AS-SM-29-2021-CS-MDPP-2","007-2022-MDPP","CONSULTORIA","S/","99859.44","99859.44","99859.44"," ","01/02/2022","07/02/2022","12/05/2022","Publicado"
"SERVICIO DE MONITOREO Y RASTREO GPS, PARA LA FLOTA VEHICULAR Y MOTOCICLETAS DE LA SUBGERENCIA DE SERENAZGO","20131366702-MUNICIPALIDAD DISTRITAL DE PUENTE PIEDRA","20600137094-GEOSATELITAL PERU E.I.R.L. - GEOSATELITAL E.I.R.L.","COMPRE-SM-1-2022-OEC-MDPP-1","129","SERVICIO","S/","53735","53735","53735"," ","03/02/2022","03/02/2022","28/02/2022","Publicado"
"ADQUISICION DE BLOQUEADORES SOLARES PARA EL PERSONAL DE LA MDPP","20131366702-MUNICIPALIDAD DISTRITAL DE PUENTE PIEDRA","20606083379-INVERSIONES GENERALES SAGITARIO M Y M E.I.R.L.","COMPRE-SM-2-2022-OEC-MDPP-1","30","BIEN","S/","41610","41610","41610"," ","07/02/2022","07/02/2022","28/02/2022","Publicado"
" ADQUISICION DE DOS (02) CAMIONETAS 4X4 + EQUIPAMIENTO PARA OPTIMIZAR EL CONTROL Y VIGILANCIA DEL SERVICIO DE SEGURIDAD CIUDADANA DE LA MUNICPALIDAD DISTRITAL DE SAN BARTOLO","20131376686-MUNICIPALIDAD DISTRITAL DE SAN BARTOLO","20608182153-CONSORCIO EQUIPOS Y SOLUCIONES AMBIENTALES PERU","AS-SM-9-2021-CS/MDSB-1","CONTRATO Nº 002-2022-GAF-MDSB","BIEN","S/","243000","243000","243000"," ","12/01/2022","13/01/2022","22/01/2022","Publicado"
"ADQUISICION DE MOTOS LINEALES Y SU EQUIPAMIENTO PARA EL PROYECTO DE MEJORAMIENTO DEL SERVICIO DE SEGURIDAD DEL DISTRITO DE SAN JUAN DE LURIGANCHO, PROVINCIA DE LIMA, DEPARTAMENTO DE LIMA","20131378034-MUNICIPALIDAD DISTRITAL DE SAN JUAN DE LURIGANCHO","20556249769-OTSUKI MOTORS S.A.C.","LP-SM-11-2021-CS/MDSJL-1","004-2022","BIEN","S/","875000","875000","875000"," ","27/01/2022","28/01/2022","29/03/2022","Publicado"
"CONTRATACION DE SUPERVISION DE OBRA ¿MEJORAMIENTO DE SERVICIO DE TRANSITABILIDAD VEHICULAR Y PEATONAL EN LA AV.PROCERES-DISTRITO DE SAN JUAN DE LURIGANCHO-PROVINCIA DE LIMA-DEPARTAMENTO DE LIMA¿ CON CODIGO UNICO DE INVERSIONES 2515875","20131378034-MUNICIPALIDAD DISTRITAL DE SAN JUAN DE LURIGANCHO","10069058251-DIAZ LAZO JOSE LUIS","AS-SM-13-2021-CS/MDSJL-1","001-2022","CONSULTORIA","S/","153441.93","153441.93","153441.93"," ","07/01/2022","14/01/2022","20/05/2022","Publicado"
"CONTRATACION DEL SERVICIO DE CONFECCION DE LAS CUPONERAS DE PAGO DEL AÑO 2022","20131378034-MUNICIPALIDAD DISTRITAL DE SAN JUAN DE LURIGANCHO","20557572831-CASARIEGO ASOCIADOS S.A.C.","AS-SM-14-2021-CS/MDSJL-1","003-2022","SERVICIO","S/","275000","275000","275000","147050.33","19/01/2022","28/01/2022","07/02/2022","Publicado"
"REMODELACIÓN DE LOS DIFERENTES PARQUES DEL DISTRITO DE SAN MIGUEL, PROVINCIA DE LIMA, DEPARTAMENTO DE LIMA - ITEM 02","20131372184-MUNICIPALIDAD DISTRITAL DE SAN MIGUEL","20510874022-SABINA CONTRATISTAS GENERALES SAC","AS-SM-22-2021-CS/MDSM-1","031-2021","OBRA","S/","205190.59","205190.59","205190.59"," ","12/01/2022","17/01/2022","18/02/2022","Publicado"
"REMODELACIÓN DE LOS DIFERENTES PARQUES DEL DISTRITO DE SAN MIGUEL, PROVINCIA DE LIMA, DEPARTAMENTO DE LIMA ITEM 03","20131372184-MUNICIPALIDAD DISTRITAL DE SAN MIGUEL","20510874022-SABINA CONTRATISTAS GENERALES SAC","AS-SM-22-2021-CS/MDSM-1","032-2021","OBRA","S/","201733.51","201733.51","201733.51"," ","12/01/2022","17/01/2022","18/02/2022","Publicado"
"REMODELACIÓN DE LOS DIFERENTES PARQUES DEL DISTRITO DE SAN MIGUEL, PROVINCIA DE LIMA, DEPARTAMENTO DE LIMA - ITEM 01","20131372184-MUNICIPALIDAD DISTRITAL DE SAN MIGUEL","20510874022-SABINA CONTRATISTAS GENERALES SAC","AS-SM-22-2021-CS/MDSM-1","030-2021","OBRA","S/","225851.71","225851.71","225851.71"," ","12/01/2022","17/01/2022","18/02/2022","Publicado"
"REMODELACIÓN DE LOS DIFERENTES PARQUES DEL DISTRITO DE SAN MIGUEL, PROVINCIA DE LIMA, DEPARTAMENTO DE LIMA - ITEM 04","20131372184-MUNICIPALIDAD DISTRITAL DE SAN MIGUEL","20510874022-SABINA CONTRATISTAS GENERALES SAC","AS-SM-22-2021-CS/MDSM-1","033-2021","OBRA","S/","193380.42","193380.42","193380.42"," ","12/01/2022","17/01/2022","18/02/2022","Publicado"
"REPARACION DE SARDINEL, VEREDA Y RAMPA O VIA DE ACCESO A UNA AUTOPISTA; EN EL (LA) JR. BOLOGNESI 5,6 Y 7, JR. CUSCO 5 Y 6 Y JR CASTILLA 5 Y 6 EN LA LOCALIDAD DE SAN MIGUEL, DISTRITO DE SAN MIGUEL, PROVINCIA DE LIMA, DEPARTAMENTO DE LIMA","20131372184-MUNICIPALIDAD DISTRITAL DE SAN MIGUEL","20600689020-ADESERG PERU S.A.C. - ADESERG S.A.C.","AS-SM-24-2021-CS/MDSM-1","001-2022","OBRA","S/","220741.88","220741.88","220741.88"," ","14/01/2022","28/01/2022","01/03/2022","Publicado"
"REPARACION DE PISTA Y VEREDA; EN EL (LA) JR. INDEPENDENCIA DE LAS CDRAS. 2 AL 7 URB. HUERTIZACION SAN MIGUEL, DISTRITO DE SAN MIGUEL, PROVINCIA DE LIMA, DEPARTAMENTO DE LIMA - PRIMERA ETAPA","20131372184-MUNICIPALIDAD DISTRITAL DE SAN MIGUEL","20562956159-QUANTUM SERVICIOS GENERALES E.I.R.L.","AS-SM-21-2021-CS/MDSM-2","03-2022","OBRA","S/","1496129.86","1496129.86","1496129.86"," ","04/02/2022","14/02/2022","14/04/2022","Publicado"
"Adquisición de Pintura de Tráfico en Base Solvente para obras de la MVMT","20131372770-MUNICIPALIDAD DISTRITAL DE VILLA MARIA DEL TRIUNFO","10423356800-ARAPA DIAZ NORMA","SIE-SIE-10-2021-CS/MVMT-1","orden de Compra N° 32-2022","BIEN","S/","74513.4","74513.4","74513.4"," ","03/02/2022","04/02/2022","09/02/2022","Publicado"
"SERVICIOS DE ALQUILER DE 03 CAMIONES DE BARANDA DE 6 TN PARA EL RECOJO, TRANSPORTE Y DISPOSICIÓN FINAL DE RR.SS.MM. EN EL AREA DEGRADADA SARAPAMPA GENERADOS EN LA ZONA (4, 5 Y 6) DE LOS CONDOMINIOS Y CLUBES DE LA PLAYA DE LA JURISDICCIÓN DEL DISTRITO DE ASIA, POR 4 MESES","20140080471-MUNICIPALIDAD DISTRITAL DE ASIA - CAÑETE","20512705252-MANEJO DE RESIDUOS SOLIDOS SERVICIOS GENERALES E.I.R.L","AS-SM-15-2021-MDA-CS-1","001-2022-MDA","SERVICIO","S/","222000","222000","222000"," ","04/02/2022","07/02/2022","02/06/2022","Publicado"
"CREACION DEL PARQUE RECREATIVO EN LA CALLE BUENOS AIRES EN EL ASENTAMIENTO HUMANO DIGNIDAD NACIONAL DEL DISTRITO DE MALA PROVINCIA DE CANETE DEPARTAMENTO DE LIMA","20158939666-MUNICIPALIDAD DISTRITAL DE MALA","20489558433-CONSORCIO BUENOS AIRES","LP-SM-1-2021-MDM-1","CONTRATO N° 05 -GAF - 2022- MDM","OBRA","S/","1996795.23","1996795.23","1996795.23"," ","02/02/2022","14/02/2022","10/08/2022","Publicado"
"AMPLIACION DE PABELLONES DE NICHOS EN EL CEMENTETERIO MUNICIPAL SAN PEDRO DE MALA DEL DISTRITO DE MALA - PROVINCIA DE CANETE - DEPARTAMENTO DE LIMA","20158939666-MUNICIPALIDAD DISTRITAL DE MALA","20544011325-CONSORCIO DIVINO JESUS","AS-SM-15-2021-MDM-1","CONTRATO Nº 004 - GAF - 2022 - MDM","OBRA","S/","859617.98","859617.98","859617.98"," ","01/02/2022","03/02/2022","31/05/2022","Publicado"
"ADQUISICION DE LIQUIDO ASFALTICO PEN 60/70 PARA LA OBRA: ""MEJORAMIENTO DE LA CARRETERA DE ACCESO DE TRAMO DE TORNAMESA - PUENTE RIO SECO, DISTRITO DE SAN BARTOLOME, PROVINCIA DE HUAROCHIRI, DEPARTAMENTO DE LIMA"", CUI Nº 2535743","20197061333-MUNICIPALIDAD DISTRITAL DE SAN BARTOLOME","20506281912-CORPORACION PERUANA DE COMBUSTIBLES S.A.C. - CORPECSAC","COMPRE-SM-1-2021-MDSB/OEC-1","ORDEN DE COMPRA Nº 001","BIEN","S/","65000","65000","65000"," ","12/01/2022","12/01/2022","14/01/2022","Publicado"
"CREACION DE LOS SERVICIOS DE MOVILIDAD URBANA EN EL ASENTAMIENTO HUMANO EL GRAN CAMBIO, SECTOR 04 DEL DISTRITO DE CARABAYLLO ¿ PROVINCIA DE LIMA ¿ DEPARTAMENTO DE LIMA","20131368314-MUNICIPALIDAD DISTRITAL DE CARABAYLLO","20518950020-TELEANDES CONTRATISTAS GENERALES S.A.C","LP-SM-2-2021-MDC/CS-1","4","OBRA","S/","2034907.47","2034907.47","2034907.47"," ","10/01/2022","01/02/2022","30/04/2022","Publicado"
"MEJORAMIENTO Y AMPLIACION DE LOS SERVICIOS DEPORTIVOS Y RECREATIVOS EN EL AREA DEPORTIVA DEL COMITÉ 33 EN EL PUEBLO JOVEN EL PROGRESO ZONA IV, DISTRITO DE CARABAYLLO ¿ LIMA ¿ LIMA","20131368314-MUNICIPALIDAD DISTRITAL DE CARABAYLLO","20534348194-CONSORCIO COMITE 33","AS-SM-28-2021-MDC/CS-2","3","OBRA","S/","991148.76","991148.76","991148.76"," ","07/01/2022","01/02/2022","30/04/2022","Publicado"
"CREACION DEL SERVICIO DE PROTECCION DE TALUDES EN EL JIRON CUZCO ENTRE EL PASAJE AREQUIPA Y PASAJE A DEL PUEBLO JOVEN EL PROGRESO ZONA III, SECTOR 03 DEL DISTRITO DE CARABAYLLO ¿ PROVINCIA DE LIMA ¿ DEPARTAMENTO DE LIMA","20131368314-MUNICIPALIDAD DISTRITAL DE CARABAYLLO","20606707534-ZRINCON CONSTRUCCIONES E.I.R.L.","AS-SM-32-2021-MDC/CS-1","1","OBRA","S/","268360.63","268360.63","268360.63"," ","04/01/2022","20/01/2022","07/03/2022","Publicado"
"MEJORAMIENTO DEL SERVICIO RECREATIVO EN EL AREA DEPORTIVA N° 02 DEL PUEBLO JOVEN VILLA ESPERANZA, SECTOR 03 DEL DISTRITO DE CARABAYLLO ¿ PROVINCIA DE LIMA ¿ DEPARTAMENTO DE LIMA","20131368314-MUNICIPALIDAD DISTRITAL DE CARABAYLLO","20608268686-CONSORCIO DIMA","AS-SM-33-2021-MDC/CS-1","2","OBRA","S/","318229.09","318229.09","318229.09"," ","06/01/2022","17/01/2022","18/03/2022","Publicado"
"CREACION DEL SERVICIO DE ESPACIOS PUBLICOS RECREATIVOS EN EL PARQUE N° 02 DE LA AGRUPACION FAMILIAR 11 DE MAYO, SECTOR 03 DEL DISTRITO DE CARABAYLLO ¿ PROVINCIA DE LIMA ¿ DEPARTAMENTO DE LIMA","20131368314-MUNICIPALIDAD DISTRITAL DE CARABAYLLO","20606384948-CONSORCIO 11 DE MAYO","AS-SM-34-2021-MDC/CS-1","5","OBRA","S/","979709.53","979709.53","979709.53"," ","18/01/2022","01/02/2022","30/06/2022","Publicado"
"CREACION DE LOS SERVICIOS RECREATIVOS EN EL PARQUE DEL PROGRAMA DE VIVIENDA RESIDENCIAL EL ENCANTO DE CARABAYLLO, SECTOR 04 DEL DISTRITO DE CARABAYLLO ¿ PROVINCIA DE LIMA ¿ DEPARTAMENTO DE LIMA","20131368314-MUNICIPALIDAD DISTRITAL DE CARABAYLLO","20600907426-GMP INGENIEROS SOCIEDAD ANONIMA CERRADA","AS-SM-35-2021-MDC/CS-1","7","OBRA","S/","680558.32","680558.32","680558.32"," ","07/02/2022","15/02/2022","18/04/2022","Publicado"
"CONTRATACIÓN DE SERVICIOS: ¿SERVICIO DE IMPRESIÓN, ARMADO Y EMBOLSADO DE LA CARPETA TRIBUTARIA 2022 PARA LA SUB GERENCIA DE REGISTRO Y FISCALIZACION TRIBUTARIA DE LA MUNICIPALIDAD DISTRITAL DE CARABAYLLO","20131368314-MUNICIPALIDAD DISTRITAL DE CARABAYLLO","20375154855-CONSORCIO EXPRESS","AS-SM-36-2021-CS/MDC-1","CONTRATO N° 008-2022-GAF-MDC","SERVICIO","S/","285595.2","311558.4","311558.4"," ","09/02/2022","10/02/2022","17/02/2022","Publicado"
"CONTRATACIÓN DE SERVICIO: SERVICIO DE DISTRIBUCION DE CARPETAS TRIBUTARIAS 2022 A LOS CONTRIBUYENTES DEL DISTRITO DE CARABAYLLO","20131368314-MUNICIPALIDAD DISTRITAL DE CARABAYLLO","20602288111-CONSORCIO REAL","AS-SM-37-2021-CS/MDC-1","CONTRATO N° 009-2022-GAF-MDC","SERVICIO","S/","363484.8","380000","380000"," ","09/02/2022","10/02/2022","28/02/2022","Publicado"
"ADQUISICIÓN DE LOS INSUMOS DE LECHE EVAPORADA ENTERA Y HOJUELAS DE CEREALES CON SOYA PRECOCIDOS ENRIQUECIDOS CON VITAMINAS Y MINERALES PARA EL PROGRAMA VASO DE LECHE AÑO 2022-2023","20131368314-MUNICIPALIDAD DISTRITAL DE CARABAYLLO","20600989040-NEGOCIOS INNOVACIONES E INGENIERIA S.A.","LP-SM-3-2021-CS/MDC-1","CONTRATO N°006-2022-GAF-MDC","BIEN","S/","7355896.46","7355896.46","3677948.23","3677948.23","02/02/2022","03/02/2022","26/12/2023","Publicado"
"SERVICIO DE DISPOSICIÓN FINAL DE RESIDUOS SOLIDOS GENERADOS EN EL DISTRITO DE CHACLACAYO","20131368233-MUNICIPALIDAD DISTRITAL DE CHACLACAYO","20297566866-PETRAMAS S.A.C.","AS-SM-9-2021-MDCH-OEC-1","CONTRATO 01-2022-MDCH","SERVICIO","S/","312703.02","312703.02","312703.02","312703.02","10/01/2022","11/01/2022","02/01/2023","Publicado"
" SERVICIO DE ALQUILER DE IMPRESORAS MULTIFUNCIONALES","20131368233-MUNICIPALIDAD DISTRITAL DE CHACLACAYO","20100466709-COPISERVICE E I R L","AS-SM-7-2021-/MDCH-CS-2","ORDEN DE SERVICIO N° 089-2022","SERVICIO","S/","81600","81600","68000","13600","08/02/2022","09/02/2022","09/02/2023","Publicado"
"SERVICIO DE IMPRESIÓN DE 39 MILLARES DE CUPONERAS TAMAÑO 34X34 CM CON SOLAPA, PAPEL CUCHE DE 250 GR. IMPRESIÓN FULL COLOR TIRA Y RETIRA, ACABADO LAMINO MATE, TROQUELADO Y PEGADO PARA LA CUPONERA AÑO 2022 Y SERVICIO DE IMPRESIÓN DE 280 MILLARES DE PAPEL TRAMADO EN FORMATO A5, PAPEL BOND DE 90 GRAMOS, IMPRESIÓN UN COLOR-AÑO 2022","20131373661-MUNICIPALIDAD DISTRITAL DE INDEPENDENCIA - LIMA","20603288760-INKPACT GRAFICA INTEGRAL S.A.C.-INKPACT S.A.C.","COMPRE-SM-1-2022-OEC-MDI-1","335-2022","SERVICIO","S/","68900","68900","68900"," ","09/02/2022","10/02/2022","15/02/2022","Publicado"
"RECONSTRUCCIÓN DEL CANAL SOL Y CAMPO EN EL SECTOR SOL Y CAMPO ENTRE KM 0.000 - KM 1.345, Y CANAL ALTO SANTA ANA EN EL SECTOR SANTA ANA ENTRE KM 0.000 ¿ KM 1.541, EN EL DISTRITO DE RICARDO PALMA","20184353904-MUNICIPALIDAD DISTRITAL DE RICARDO PALMA","20529066521-CONSORCIO JESUS AMIGO","PEC-PROC-1-2021-MDRP-1","001-2022/MDRP","OBRA","S/","478945.8","478946","0","1250053.8","17/01/2022","01/02/2022","31/05/2022","Publicado"
"ADQUISICIÓN DE CEMENTO PORTLAND TIPO I PARA LA EJECUCIÓN DEL PROYECTO DE INVERSIÓN DENOMINADO: ""MEJORAMIENTO DE PISTAS Y VEREDAS TRAMO 1: AYACUCHO (ENTRE JR. FERROCARRIL Y JR. INDEPENDENCIA), TRAMO 2: JR. INDEPENDENCIA - DISTRITO DE SAN MATEO - PROVINCIA DE HUAROCHIRÍ - DEPARTAMENTO DE LIMA¿ CON CÓDIGO ÚNICO DE INVERSIÓN Nº 2521951","20196625608-MUNICIPALIDAD DISTRITAL DE SAN MATEO","10767528324-GARCIA ZAPATA ANGELY MEDALIN","SIE-SIE-2-2021-MDSM/CS-1","S/N","BIEN","S/","45900","45900","45900"," ","07/01/2022","08/01/2022","28/01/2022","Publicado"
"Adquisición de Licencias de Software Microsoft","20131371293-INSTITUTO PERUANO DE ENERGIA NUCLEAR","20543312232-SOFTLINE INTERNATIONAL PERU S.A.C.","LP-SM-2-2021-IPEN-1","N°001-2022-IPEN-ADMI","BIEN","S/","393567","393567","393567"," ","27/01/2022","28/01/2022","11/02/2022","Publicado"
"Adquisición de Cámaras de vigilancia para los pabellones A1, A2, A3, A4, A5 y A6 del GMML","20100164958-EMPRESA MUNICIPAL DE MERCADOS S.A.","20508553413-CONSORCIO SANTA ANITA","AS-SM-6-2021-EMMSA-1","Contrato N° 025-2022-EMMSA-GAJ","BIEN","S/","420000"," "," "," ","08/02/2022","09/02/2022","25/03/2022","Publicado"
" SERVICIO DE MEDICO OCUPACIONAL QUE BRINDE EL SERVICIO DE ATENCIÓN MEDICA OCUPACIONAL VIGILANCIA, PREVENCIÓN CONTROL Y SEGUIMIENTO DE CASOS COVID 19 DE LOS SERVIDORES DE LA CORTE SUPERIOR DE JUSTICIA DE LIMA NORTE","20550734223-CORTE SUPERIOR DE JUSTICIA DE LIMA NORTE","20601310032-ASSO CONSULTORES S.A.C. -  ASSO CONSUL S.A.C.","AS-SM-7-2021-OEC-CSJLN-PJ-2","CONTRATO N° 001-2022-P-CSJLN/PJ","SERVICIO","S/","135600","135600","116766.67","184433.33","19/01/2022","20/01/2022","19/01/2023","Publicado"
"SERVICIO DE ACCESO DE INTERNET Y SEGURIDAD GESTIONADA POR MEDIO DE FIBRA ÓPTICA PARA LA DIRIS LIMA NORTE","20602217508-DIRECCION DE REDES INTEGRADAS DE SALUD LIMA NORTE","20546904106-NEXTNET S.A.C.","AS-SM-18-2021-DIRIS LN-1","ADJUDICACIÓN SIMPLIFICADA N° 018-2021-DIRIS LN","SERVICIO","S/","56611.68","56611.68","28305.84","138617.84","05/01/2022","04/02/2022","03/02/2024","Publicado"
"CONTRATACIÓN DE SERVICIO DE RACIONES ALIMENTARIAS PARA EL PERSONAL MÉDICO Y PACIENTES HOSPITALIZADOS DE LOS CENTROS DE OXIGENOTERAPIA ANCON, RIMAC, CARABAYLLO, PUENTE PIEDRA, INDEPENDENCIA, VILLA ESTELA Y HOSPITAL DE APOYO CARABAYLLO DE LA DIRIS LIMA NORTE","20602217508-DIRECCION DE REDES INTEGRADAS DE SALUD LIMA NORTE","20550470901-UMAMI FOODS PERU S.A.C.","CP-SM-6-2021-DIRIS LN-1","CONTRATO N° 006-2022-MINSA/DIRIS.LN/3","SERVICIO","S/","681950.4","1363900.8","1363900.8","75850.8","01/02/2022","03/02/2022","02/08/2022","Publicado"
